{
  "artifact_type": "freeze_record_v1",
  "schema_version": "0.1.0",
  "protocol_version": "1.0",
  "agreement_id": "agr-001",
  "revision_id": "rev-001",
  "freeze_id": "fr-001",
  "state_commitment": "sha256:state001",
  "evidence_commitment": "sha256:evidence001",
  "event_commitment": "sha256:event001",
  "frozen_at": "2026-03-18T00:06:00Z"
}
